title,abstract,url
Top 10 Lithium-ion Battery Manufacturers in China,"Headquarters: Ningde, Fujian Overview: CATL is one of China's largest lithium-ion battery manufacturers and a global leader in battery manufacturing. Key Products. Lithium-Ion Batteries for Electric Vehicles (EVs): A leading manufacturer focuses on high-performance EV batteries with continuous innovations for enhanced energy density, longevity, and safety.",https://www.ufinebattery.com/blog/top-10-lithium-ion-battery-manufacturers-in-china/
Top 10 Lithium Battery Manufacturers in China - My WordPress,"BSLBATT is a top lithium-ion battery manufacturer specializing in energy storage systems (ESS), electric vehicles (EVs), and other industrial applications. The company is well-known for producing high-quality lithium iron phosphate (LiFePO4) batteries, which are highly regarded for their safety, lifespan, and environmental friendliness compared ...",https://minghongpower.com/blog/lithium-battery-manufacturers-in-china/
Top 9 Chinese Lithium Battery Manufacturers ( 2024 Guide),"Location (Headquarters): Shenzhen, China Year Established: 2013. Primroot.com is a leading-edge professional solar lithium battery & inverter manufacturer based in the high-tech hub of Shenzhen, China. Fueled by the creative spirit and expertise of our world-class research and development team, we are at the forefront of the Photovoltaic (PV) and lithium battery industry, driving innovative ...",https://primroot.com/chinese-lithium-battery-manufacturers/
Top 15 Lithium Ion Battery Manufacturers In China - Polinovel,"Here is a quick look at the top lithium-ion battery manufacturers in China: 1. Polinovel; 2. Guangdong Aokly Group Co., Ltd; 3. Nanjing Torphan Tech Co., Ltd; 4. Shenzhen ACE Battery Co., Ltd ... Ltd is one of the leading lithium battery manufacturers in China and exports to about 150 global countries. They produce lithium batteries that can ...",https://www.polinovelgroup.com/lithium-batteries-manufacturers/
Lithium Battery Manufacturers in China: Top 12 Suppliers,"China Aviation Lithium Battery. China Aviation Lithium Battery is a manufacturer and exporter of lithium batteries based in Henan province. China Aviation Lithium Battery is a state-owned company that was founded in 2007. In addition to producing lithium batteries, it also manufactures power systems for various applications.",https://www.chinaimportal.com/blog/lithium-battery-manufacturers/
Top 10 lithium ion battery manufacturers in China,"In terms of orders, since this year, CATL has locked a number of long orders. The company has won a 3-year total 15GWh order from Fisker, a 5-year order from Jinkang New Energy, a 4-year order from Tesla, a 10-year long-term strategic cooperation agreement with Great Wall Motor, a 7-year order from Benz commercial vehicles, and increased supply to BMW, Volkswagen, Hyundai, Rolls-Royce, etc.",https://www.takomabattery.com/top-10-lithium-ion-battery-manufacturers-in-china/
Top 10 Lithium-ion Battery Manufacturers in China for 2025,"10 Best Lithium-ion Battery Manufacturers in China: 1. Tritek 2. BYD 3. CATL 4. Gotion 5. CALB 6. EVE Energy 7. REPT 8. Great Power 9. Lishen 10. ... Top 10 Lithium-ion Battery Manufacturers in China. Below are the top 10 lithium battery companies shaping China's market in 2025, selected for their innovation, certifications, and global impact ...",https://tritekbattery.com/lithium-ion-battery-manufacturers-in-china/
Top 10 Lithium ion Battery Manufacturers in China 2024,"Above is the top 10 lithium ion battery manufacturers in china 2024.NBCELLENERGY as a battery pack manufacturer is the partner of the above companies, and can offer you the best agent price of lithium ion battery cells from the above manufacturers. We can offer you the best price for the lithium-ion battery cells of the above manufacturers ...",https://nbcellenergy.com/top-10-lithium-ion-battery-manufacturers-in-china-2024/
Top 7 Lithium Ion Battery Manufacturers in China - Enerforce,"As the largest lithium-ion battery manufacturer in China, CATL has rapidly ascended to global prominence, establishing itself as a dominant force in the EV and energy storage markets. With an impressive track record of innovation and research, CATL is widely recognized for producing high-performance batteries that power some of the world's ...",https://www.enerforcebattery.com/top-7-lithium-ion-battery-manufacturers-in-china/
10 Best Lithium Ion Battery Manufacturers In China - Pknergy,"Ganfeng Lithium is a comprehensive lithium battery manufacturer involved in lithium mining, refining, battery design and production, as well as battery recycling and reuse. Founded: 2000 Headquarters: Xinyu, Jiangxi, China. Key Products. Lithium Battery Cells Ganfeng Lithium offers cylindrical and prismatic battery cells of various capacities.",https://www.pknergy.com/news/10-best-lithium-ion-battery-manufacturers-in-china/
Top 10 Lithium Battery Manufacturers in China - HIITIO,"Conclusion: Innovation Drives the Future. While the top 10 lithium battery manufacturers in China lead the industry, specialized suppliers like HIITIO are emerging as key players in niche markets. Whether it's in electric forklifts, golf carts, or other industrial applications, the innovative use of lithium batteries is paving the way for greener and smarter energy solutions.",https://www.hiitio.com/top-10-lithium-battery-manufacturers-in-china/
Top 10 Lithium Battery Manufacturers in China - 一级 - News,"1.CATL - Top Lithium Battery Manufacturer in China. CATL is a globally renowned lithium - battery giant. It was founded in 2011 in Ningde. The company is committed to the research and development, production, and sales of power battery systems for new - energy vehicles and energy - storage systems.",https://www.mecc-xpower.com/news/top-10-lithium-battery-manufacturers-in-china-84113462.html
Top 10 Lithium ion battery manufacturers in China - NPP POWER,"Shenzhen Desai Battery Technology Co., Ltd., as one of the leading manufacturers in the field of global lithium battery power supply, the company's small mobile power management system ranks first among the counterparts in China and serves the world's top consumer electronics manufacturers; a number of technologies of electric vehicle power ...",https://npplithium.com/top-10-lithium-ion-battery-manufacturers-in-china/
Top 10 lithium ion battery cell manufacturers in China,"One of the top 10 lithium ion battery cell manufacturers in China CATL was established in 2011, also is one of the top 10 sodium ion battery companies in the world, targeting power batteries.At the beginning of its establishment, ATL held 15% of CATL's shares and transferred the shares in 2015.",https://batteryswapstation.com/top-10-lithium-ion-battery-cell-manufacturers/
Top 100 Lithium ion battery Manufacturers in china,"Established：2005 Company profile：Hefei Gotion High-tech Power Energy Co., LTD.(hereinafter referred to as ""Hefei Guoxuan"") is a wholly-owned subsidiary of Guoxuan High-tech.The company is one of the earliest enterprises engaged in the independent research and development, production and sales of lithium-ion batteries for new energy vehicles in China, specializing in the research and ...",https://www.takomabattery.com/top-100-lithium-ion-battery-manufacturers-in-china/
Top 10 Lithium Battery Manufacturers in China,"Top 10 Lithium Battery Manufacturers in China. There are many lithium battery manufacturers. With the rapid development of new energy vehicles and UPS storage, the market demand for lithium batteries has increased, and more and more companies have begun to enter the lithium-battery industry.",https://www.improvecn.com/articles/top-10-lithium-battery-manufacturers-in-china
Lithium Ion Battery Manufacturers In China - Chinese MFG,"Discover China's leading lithium-ion battery manufacturers, including CATL, BYD, and Ganfeng Lithium. Explore their advanced technologies, global impact, key applications in EVs and energy storage, and future trends. Learn sourcing tips and navigate challenges in this vital industry driving clean energy and innovation.",https://chinesemfg.com/lithium-ion-battery-manufacturers-in-china/
Top 15 Lithium Battery Pack Manufacturers in China,"In this article, we'll introduce top 15 lithium battery pack manufacturers in China who are shaping the future of energy storage and mobility. Let's take a brief look at the best lithium-ion battery manufacturers in China list (in no particular order of priority): Shenzhen Tritek Limited; Shenzhen Polinovel Tech Co., Ltd; Holo Battery; ECO ...",https://tritekbattery.com/top-15-lithium-battery-pack-manufacturers-in-china/
Top Chinese Lithium Battery Manufacturers Dominating Market,"Explore the rise of Chinese lithium battery manufacturers transforming the global energy storage industry. Discover top companies like CATL and BYD, their innovations in EV and renewable energy solutions, and their impact on the market. Learn about the varied applications, industry standards, export regulations, cost factors, and future trends shaping this dynamic sector.",https://chinesemfg.com/chinese-lithium-battery-manufacturers/
Top 10 Lithium Battery Manufacturers in China - Grepow,"5. AVIC Lithium Battery. AVIC Lithium Battery Co., Ltd., a subsidiary of Aviation Industry Corporation of China, is a high-tech new energy enterprise specializing in R&D and the production of lithium-ion power batteries and lithium battery management systems.",https://www.grepow.com/blog/top-10-lithium-battery-manufacturers-in-china.html
Top 10 Lithium Battery Manufacturers in China,"There are many lithium battery manufacturers. With the rapid development of new energy vehicles and UPS power storage industry. The demand for lithium batteries has been greatly stimulated, and various companies have begun to enter the lithium battery manufacturer industry. China's lithium-ion battery market is also booming.",https://www.ecolithiumbattery.com/top-10-lithium-battery-manufacturers-in-china/
Top 10 Lithium Ion Battery Manufacturers in China,"5. CALB (China Aviation Lithium Battery) China Aviation Lithium Battery (CALB) was founded in 2007 and mainly provides power battery and energy storage solutions. Its products are used in passenger cars, commercial vehicles, energy storage, and emerging markets such as electric forklifts, sightseeing vehicles, and airport service vehicles.",https://www.delongtop.com/top-10-lithium-ion-battery-manufacturers-in-china/
13 Largest Battery Manufacturers In The World [2025],"CALB (short for China Aviation Lithium Battery Technology) is among the top five Chinese battery manufacturers specializing in the research, development, production, and sales of high-quality lithium-ion batteries. It operates multiple production facilities across China, with major plants located in Wuhan, Luoyang, and Changzhou.",https://www.rankred.com/largest-battery-manufacturers/
Top 18 Lithium Ion Battery Manufacturers in 2025,"Some of the top 10 lithium-ion battery manufacturers in the world include: 1. CATL (Contemporary Amperex Technology Co., Limited) ... In the realm of power batteries, during January-February 2023, the company clinched spots among the top five in China's New Energy Passenger Vehicle market and breached the top ten globally. Moreover, for ...",https://manlybattery.com/top-10-lithium-ion-battery-manufacturers/
2023 The TOP100 China Lithium Battery Manufacturer List! - HARVEYPOW,"In conclusion, the ""Top 100 China Lithium Battery Manufacturers List"" serves as a valuable resource for those seeking reliable suppliers of lithium batteries in China. It enables you to navigate the diverse landscape of the Chinese lithium battery industry and select trusted manufacturers that align with your specific requirements.",https://harveypoweress.com/top100-china-lithium-battery-manufacturer/
Top 10 battery energy storage manufacturers in China,"This article will focus on top 10 battery energy storage manufacturers in China including SUNWODA, CATL, GOTION HIGH TECH, EVE, Svolt, FEB, Long T Tech, DYNAVOLT, Guo Chuang, CORNEX.",https://www.huntkeyenergystorage.com/top-10-battery-energy-storage-manufacturers-in-china/
Leading Battery Pack Manufacturers in China: A 2025 Overview,Top 10 Battery Pack Manufacturers in China Image Source: unsplash. China's battery pack manufacturers are leading the charge in revolutionizing energy storage solutions. Let's dive into the top players shaping this dynamic industry. ... The China Lithium-Ion Battery Market is projected to grow from $8.86 billion in 2023 to $23.91 billion by ...,https://www.large-battery.com/blog/leading-battery-pack-manufacturers-in-china-a-2025-overview/
Top 30 power battery manufacturers in China in 2022,"As Top 30 power battery manufacturers in China was established on 2020-10-21, the legal representative is Chi Lin, the registered capital is RMB 1 million, the company address is located in Jiaojian Village, Qinlan Town, Tianchang City, and its industry is electrical machinery and equipment manufacturing The business scope includes: lithium ...",https://www.takomabattery.com/top-30-power-battery-manufacturers-in-china-in-2022/
Top 10 Lithium Battery Pack Manufacturers in China,"Polinovel is a reliable lithium battery manufacturer in China. They combine R&D, manufacturing, and sales to serve distributors and exporters. With over 15 years of expertise, Polinovel delivers long-lasting and safe lithium battery solutions for various commercial applications.",https://holobattery.com/lithium-battery-pack-manufacturers-in-china/
EV battery manufacturers 2025| Statista,"The largest lithium-ion battery companies worldwide were located in the Asian continent. China, South Korea, and Japan led the ranking in 2025.",https://www.statista.com/statistics/235323/lithium-batteries-top-manufacturers/
